{"id":"batch-command-schema-discovery","kind":"new_capability","target":"mcp_interface","friction":"Complex workflows repeatedly queried command schemas before execution: 5 queries in layer-organization, 7–9 in each surface-construction run, and 14 in photo-reconstruction. These are observations of repeated discovery overhead; they do not establish a defect or explain the much larger token totals.","evidence":["assembly: pass, 5 describe_command calls among 24 MCP attempts","closed-body: pass, 7 describe_command calls among 28 MCP attempts","posed-body: pass, 9 describe_command calls among 27 MCP attempts","alternate-body: fail, 9 describe_command calls among 64 MCP attempts","chair: unscored, 14 describe_modeling_command calls among 95 MCP attempts","All historical runs are comparison-ineligible because agent model/version, task, evaluator, and environment were not commonly pinned"],"hypothesis":"A machine-readable batch command-catalog capability, with concise schemas for multiple requested commands in one response, may reduce repeated schema-discovery calls and associated time and tokens across command-heavy workflows. It must be tested with fixed comparison pins; no task-success or efficiency improvement has yet been measured.","discovery_families":["layer-organization","surface-construction","photo-reconstruction"],"validation_families":["layer-organization","surface-construction","photo-reconstruction","curve-editing"],"held_out_families":["curve-editing"],"metrics":["task_success","failed_tool_calls","mcp_calls","elapsed_seconds","tokens","recovery_success"],"preserve":["Task correctness and deterministic acceptance criteria","Existing command schemas, defaults, and validation behavior","Existing individual describe-command capability for compatibility and targeted lookup","Fixed agent model/version, task prompts, evaluator, budgets, environment, and gateway configuration across baseline and candidate runs","No causal conclusion when any comparison pin or result is missing"],"status":"proposed"}
